content	label
Νέα και όμορφη γυναίκα και έχουν αποφασίσει να την ντύνουν με ρούχα που θυμίζουν παλιά ριχτάρια και αερόστατα . Κρίμα γιατί την αδικούν elaxamogela	0
@USER Η Μαρτίνα γιατί νομίζει ότι είναι και όμορφη GNTMgr	0
@USER Ετσι ειναι Νικο η πουτανα η τύχη .	1
Μαρία χαλάρωσε τα βυζγιά σου gntmgr	1
@USER Να ακούσω τον πολάκη να λέει ότι ο καλύτερος υπουργός υγείας που πέρασε ποτέ απ αυτό το υπουργεί ήταν ο ΑΔΩΝΗΣ και ας πεθάνει ο πούστης .	1
Η Μαρτίνα αποχώρησε γιατί οι κότες αρνήθηκαν να φωτογραφηθούν μαζί της . gntmgr	0
ΒΑΣΙΛΙΣΣΑ ΤΗΣ ΤΡΕΣΣΑΣ ! ΤΟ ΧΡΕΙΑΖΟΤΑΝ ..ΧΩΣΕ ΠΑΡΙΣ ! shoppingstar	0
Σε αυτή τη σκηνή ειδα πρώτη φορά την Κίτσου και τον Στάνκογλου ως ζευγάρι . agriesmelisses GNTMgr	0
Σακης ... Χριστινακι μου γλυκο ! στα καπακια εισασταν καταπληκτικη ! αποφασισε χρυσουλι μου Ενικος η Πληθυντικος; τι στο καλο διπολικη διαταραχη εχεις παθει; TheVoiceGR	0
Αλλαξα σερβιετα, ξεβαφτηκα, εβαλα κρεμα, επλυνα τα δοντια μου και ακομα να αρχίσει . Λετε να κανω και ενα μπανιο GNTMgr	0
skaipolxeftiles poweroflovegr -Βίλμα είστε φίλες από το σχολείο με τη Ζένια; -Ναι . Αγαπιόμαστε πολύ . -Βρίσκεστε συχνά; -Όχι τόσο . -Πότε βρεθήκατε τελευταία φορά; -Τρίτη δημοτικού . Μου μίλησε για να της δανείσω το ψαλιδάκι μου .	0
Μούνα σήμερα η Ζενεβιεβ gntmgr	1
gntmgr Μάζεψε τα σάλια σου ρε σίχαμα Ασημίνα ...	1
Νταξει και η Ελευθερια μεγαλη στρουχτριτσα GNTMgr	0
Αχ βρε Λορειν, εδω μισο αιώνα ζει κ δεν εχει μάθει Ελληνικά shoppingstar	0
@USER Υποψηφιου γιος δεν εισαι;	0
Πιάσε μούρες και βγάλε συμπέρασμα ΣΥΡΙΖΑ_ξεφτιλες	0
@USER Αφού πάνε μεταξύ τους, δεν έχουν ανάγκη την γυναίκα . .Στο Πακιστάν λέει βιάζουν και κότες ..	1
Όχι ρε Αννούλα κριμα erwtasmeta	0
@USER Μη με κουρδίζεις νυχτιάτικα, βαλτός είσαι και εσύ;	0
@USER Και ειλικρινά αναρωτιέμαι αυτός ο Χελμης μόνο φίλος είναι; Κάποια σχέση με την παραγωγή; Δεν μπορώ να πιστέψω πως ένας φίλος έχει τέτοια επιρροή ...γτ σιγά και τους φοβερούς μάγειρες που επέβαλε αλλά τους έφτασε εκεί που τους έφτασε MasterChefGR_Xeftiles	0
@USER Έχω να πω επίσης ότι εγώ δεν έχω καπότα επειδή το "ξέχασα", εσυ αν έχεις καπότα είσαι ποθτανα	1
ΕΛΕΥΘΕΡΙΑ ΘΕΛΩ ΝΑ ΣΕ ΧΤΥΠΗΣΩ ΑΛΗΘΕΙΑ gntmgr	1
Πάλι κλάμα; Τόσο κλάμα ουτε η Βουγιουκλάκη σε όλες τις ταινίες GNTMgr	0
Να αγαπάτε και να εκτιμάτε αν έχετε ψιλή φωνή . Μπορείτε να λέτε άνετα στα εταιρικά τηλεφωνήματα ότι δεν υπάρχει ενήλικας σπίτι και να σας παρατάνε . gntmgr	0
ο άλλος θεωρεί ότι οι γυναίκες στην κουζίνα έπρεπε να δουλεύουν μόνο στην κρύα γιατί είναι δύσκολη δουλειά για μία γυναίκα εγώ:	1
Να φανταστεί κανείς ότι στο μπαλκόνι του, καπνίζοντας, μπορεί να έχει την μουσική του μέχρι της 23:00 με την παρέα του . Ομολογώ ότι η ανακοίνωση του μέτρου αυτού, για σιγή στα μαγαζιά από τις 22:00, ίσως τελικά "καταφέρει" να κλείσει τα τελευταία που την "πάλευαν" ΝΔ_θελατε	0
@USER Τι λες μωρη . Δλδ αν γλειφω καμια γκομενα αλλα γουσταρω τη πουτσα ειμαι καταπιεσμενη λεσβια; διαφωνω φουλ . Αυτες τις ταμπελες τις βαζουν οι κομπλεξικες κραγμενες που τους βγαζουν ολους γκει .ακομα κ τους στρειτ	1
@USER Οι δυο ξένοι είναι μια σειρά που έχει τα πάντα χιουμορ συγκίνηση ερωτα ατάκες και οι πρωταγωνιστές η απόλυτη χημεία	0
Αυτό το ψεύτικο κλάμα της Κατιας πολύ μου την δίνει gntmgr	0
XFactorGR κ εσύ θετική ενέργεια Μάστορα; Σπάσε λίγο κ για μας	0
οι συριζοκόπροι που δεν έκαναν τίποτα για δεκάδες χιλιάδες άστεγους στα πεζοδρόμια(το 1/3 πρόσφυγες), προσεγγίζουν το προσφυγικό με ανθρώπινη ευαισθησία .. Το πρόγραμμα του @USER έλεγε για εύρεση στέγης σε συνεννόηση με τους δήμους, αλλά δεν βλέπω κίνηση ..	1
Και που το εξήγησες Τερζόπουλε, νομίζεις κατάλαβε; poweroflovegr	0
Τα παπούτσια τα άφησε στην πόρτα του μαγαζιού ShoppingStar	0
@USER Ρε συ θα πρέεπει να είσαι πολύ ψυχοπονιάρα με τέτοιο βυζί ..! Θέλω τη μαμά μου ..	1
Άσχημο να είσαι πίσω στο σκορ σε τελικό από την ομάδα των καραγκιόζηδων κ του μάστερ στις καθυστερησεις ! Υγ . Συγχαρητήρια για την οργάνωση ρε γελιοι @USER Ξεκίνησε το παιχνίδι κ ο μισός κόσμος ήταν εξω	1
@USER -Ο Κουλης ;χαχαχα - αυτος ειναι αυγουλοματης χαχαχ - γελαει σα μπουφος - ο Τσιπρας δε χανει απο αυτον -Εισαι πολυ λιγος για μενα - κοιτα φατσα ο "Κουλης" ΦΦΦΑΑΑΑΑΑΑΑΠΠΠΠΠΠΠ	0
Στα φανάρια δεν βλέπεις πια γύφτο να πλένει τζάμια . Όλους τους μάζεψε ο Αλ6ς ! ΜεΤονΣΥΡΙΖΑ Τσίπρας Ευρωεκλογές2019 ερχεται_ΒΟΙΔΟΠΟΥΤΣΑ ερχεται_ΠΟΥΤΣΑ syriza_xeftiles	1
Αντι να λες "τι κάνει το ΕΣΡ" κανε εσύ καταγγελία για το mesimeri_skai Εύκολο είναι, εδω μπαίνεις και συμπληρώνεις τη φόρμα	0
Αφού περνάνε τόσο ωραία οι πρόσφυγες και έχουν και επιδόματα,λέω να ανταλλάξετε κάποιοι τη ζωή σας με τη δίκη τους,μιας και ζηλεύετε τις ανέσεις τους . Όποτε τραβάτε στη Μόρια να ζείτε σε σκηνή με τα ποντίκια . Διαφορετικά βγάλτε τον σκασμό και στις τρύπες σας σκουπίδια .	0
και καλα αυτη που εχει ασυλια να ουρλιαζει ! οι αλλες γιατι τσιριζουν ; GNTMgr	0
Σιγά μην είναι η Λασκαράκη ο θύτης χαχαχαχ erwtasmeta	0
Άντρες που ντρέπονται να αγκαλιάσουν την γυναίκα τους δημοσίως αυτή η μάστιγα	0
κυρανακης Γιαννουλης Εδώ βλέπετε το μόνο θηλυκό που δεν κινδυνεύει με βιασμό από τους ισλαμοπίθηκους .	1
ScandalBook Ο τραγουδιστής των Iron Maiden παράτησε την γυναίκα του για 45χρονη θαυμάστρια	0
Θα σε φάνε ζωντανό οι ίδιοι οι μέχρι πρότινος κλακαδόροι σου . Αυτό είναι το μεγαλείο της αριστεράς . ερχεται_ΠΟΥΤΣΑ ΣΥΡΙΖΑ_ξεφτιλες	0
@USER Αυτα που κανεις 20 χρονια στο μπασκετ επιστρεφουν στα υπόλοιπα σπορ σου ...ΠΟΥ ΔΕΝ ΧΟΡΤΑΙΝΕΙΣ ΠΟΥΤΣΑ	1
@USER Στον αέρα έριξε και ο μαλακας στην Θήβα ! Τα όπλα είναι όπλα και όταν ένας μπάτσος σκοτώνει έναν ένοπλο, δεν μπορώ να πω κουβέντα . Ναι λοιπόν μέχρι το 1993 αυτοί οι άνθρωποι ζούσαν σε επιτηρούμενη ζώνη από το στρατό . Αυτήν (και οχι μόνο) την "ενσωμάτωση" πληρώνουμε ...	0
Αυτό το τικ με τη γλώσσα να το κοιτάξει η ΣΚάτια gntmgr	1
- Τι σας ενοχλεί με τους πρόσφυγες κυρία μου; - Η συμπεριφορά τους, τα εγκλήματα, οι βιασμοί . - Και ποιος σας είπε ότι θα τα κάνουν αυτά; - Εσείς τα λέγατε στις ειδήσεις . - Παλιά κυρία μου για να πέσει ο Τσίπρας, τώρα κυβερνάει ο Μητσοτάκης, εκπολιτίζονται και μόνο στην ιδέα .	0
Υπέροχη Βασιλική Ανδρίτσου . giatinparea	0
Τοσο χάλια είσαι ;	0
@USER Σκευωρία, και πέρασε ο άνθρωπος την ζωή του στην φάμπρικα και την εξορία,,, επιτέλους δικαιοσύνη	0
Φαντάζομαι τον Τζώρτζογλου εφορευτική επιτροπή, ακόμα στην ουρά για να ψηφίσουμε θα ήμασταν .... GynaikaXwrisOnoma	0
@USER μου αρέσει που απαντάς με επιχειρήματα ..... χαχαχχαχαχχαχαχαα υπομονή 5 εβδομάδες ....... το ξεκώλιασμα σου και των φίλων σου θα είναι διαστημικό ... κάνε μπιντέ να είσαι έτοιμος	1
@USER Ελένη μου χρόνια σου πολλά ..να είσαι πάντα καλά !	0
@USER Λεει σε μια στιγμη ο Χατζηνικολας "δεν ειμαι εγω κυβερνηση" και του απαντα ο Αδωνης "εισαι φερεφωνο της κυβερνησης"	0
η φάτσα μου όταν βλέπω την Ασημίνα gntmgr	0
@USER Να είσαι καλά Αστραπόγιαννε μου, ευχαριστω	0
Το σωστο θα ηταν να φυγει η Κατια λογω συμπεριφορας . Και ανατρεπτικο . Αλλα που μυαλο εκει . Παιδια, υπαρχουν πολλες συνταγες να βγαλετε λεφτα, σκεφτειτε λιγο πιο εξυπνα gntmgr	0
Ρε είναι δυνατόν; Σκουλε αγαπημένε τι έχεις πάθει με την Κατια; Μαγιά σου έχει κάνει; GNTMgr	0
@USER Σε παραδέχομαι μωρή φώφη αρχηγηνάρα ξεπέρασες τον Τσίπρα στις μαλακίες συνεχίζεις το έργο του ΓΑΠ κοντεύεις να το διαλύσεις το΄ΠΑΣΟΚ συνέχισε είσαι σε καλό δρόμο .	1
Βασικά Σουζάνα κάνε την Ναόμι Κάμπελ της γειτονιάς σαν την άλλη που πηγε στη Πάνια κα καλά είσαι ! gntmgr	0
@USER Χασου ...είσαι λίγη .	0
Δείτε λίγο Αννα-Μαρια GntmGr	0
Μαρίνα, και σήμερα να φύγεις (που δεν θα φύγεις) εμείς θα σε θυμόμαστε για το καλό που έκανες στο προηγούμενο επεισόδιο και την ξεμπρόστιασες την φαρμακόγλωσσα GNTMgr	1
Μπαζ(ο) παντελόνι Τζιπ κιλοτ σαν range Rover giatinparea shoppingstar	0
@USER Συμφωνώ . Αταλαντο, καβαλημενο αγενέστατο και στήθηκε όλο αυτό το τσίρκο με τους άλλους 2 κακομοίρηδες τους Cover για να προβληθεί το ανήλικο . Ρε ουστ μαλακισμενο	1
Εγω προτεινω ο Πατουλης να εφαρμοσει το συστημα των παλαβων μονοδρομων που εφαρμοσε στο Μαρουσι σε ΟΛΗ τη περιφερεια, να μην υπαρχει περιπτωση να μπει ξενος μεσα, να ησυχασουμε	0
Με το ζόρι να γίνει μοντέλο . ΔΕ ΜΠΟΡΕΙ ΛΕΜΕ gntmgr	0
Η εποχή απαιτεί γυναίκες, όχι πριγκίπισσες . Το νου σας λοιπόν .	0
XFactorGR TheVoiceGR gntmgr 8lexeis guessmyagegr shoppingstar anhmounplousios erwtasmeta ElaStiThesiMou kalomesimeraki Συγκίνησε ο πιλότος του F-16 της ομάδας Ζευς: Τούτος ο λαός δεν γονατίζει παρά μόνο μπροστά στους νεκρούς του(video)	0
Ξεκόλλα είσαι χάλια σε καταλαβαίνω δεν σε χωρίζω βλαμμένη	1
Αν είσαι αναποφάσιστος, το παρακάτω video μπορεί να σου δώσει το κίνητρο που χρειάζεσαι για να επιλέξεις . nd_xeftiles	0
ρουφ γάρδεν ! kalytera	0
Εν τω μεταξύ ο φασίστας δήμαρχος κατέβηκε με τον Σύριζα σουργελα syriza_xeftiles	0
Σήμερα απολογήθηκε ο Νίκος Μιχαλολιάκος με τους υποστηρικτές του να φωνάζουν εντός του δικαστηρίου «αίμα, τιμή, Χρυσή Αυγή». Σήμερα χαράκωσαν έναν μαθητή από το Ιράν στην Θεσσαλονίκη . Σήμερα έπρεπε μία κυβερνητική ...	0
Καλησπερα και καλη εβδομαδα τουιτερο-στυλιστριες !Να και μια φορα που καταφερα ναμαι κι εγω μαζι σας ! Τι βλεπουμε; Ποιο ειναι αυτο το νευρωσικο παρτσακλο; shoppingstar	1
Show Άννα μου είσαι εσυ GNTMgr	0
@USER Τη Δροσω λεγαμε, η Ασημινα μας βγηκε μαλακισμενο ..	1
Μόνο εγώ βαριέμαι άπειρα τα "μαγικά" σόου; GNTMgr	0
Γιατί Γκαγκακη, είστε για πιο σοβαρά θέματα μωρή ηλιθια; Το προηγούμενο θέμα είδες πώς το γελοιοποιησατε; Μόνο για τέτοια είστε, τι παραπονιέστε; Είστε ελεεινοί και τρισάθλιοι . mesimeri_skai	1
Να πεσει στη θαλασσα να γινει και αυτη κουτσομουρα . Χαχαχαχα γελαω gntmgr	0
@USER Στα ξένα είμαι Έλληνας και στην Ελλάδα ξένος .	0
gntmgr ο φωτογράφος καλά πέρασε μπράβο μπράβο	0
Η Δέσποινα ψωνίζει σκουλαρίκια απο το ιδιο μαγαζί με την Μπακοδημου; shoppingstar	0
Εγώ .... τώρα gntmgr	0
Φιλικη συμετοχη Τανιμανιδη;GNTMgr	0
@USER τωρα εισαι προκλητικος	0
Γεια σου διακριτικε ερωτιλε @USER οπως σε ειπε η Αλεξανδρα Παλαιολογου ERWTASMETA	0
Ηταν θεριό που κείτουνταν στην θάλασσα δεν ήταν νησί δεν ήταν νησί GNTMgr	0
@USER Είσαι αναιδης .	0
Ηταν ενας μι-κρος φασίστας,ήταν ενας μι-κρος φασίστας,που ήταν α α αταξίδευτος,που ήταν α α αταξίδευτος,οε οεεεε οε οε	1
"Σας ευχαριστω απο καρδιας" μας ειπε ο @USER κλεινοντας την ομιλια του με ματια συγκινημενα .. Εισαι ηγετης ! Τελος	0
Η Νορα σημερα παλι αδεια εγκυμοσυνης; ΔΕΝ ΜΠΟΡΕΙ ΝΑ ΛΥΣΕΙ ΑΛΛΟΣ ΤΟ ΜΥΣΤΗΡΙΟ ΑΣ ΤΟ ΑΠΟΔΕΧΤΟΥΜΕ ΝΑ ΠΑΜΕ ΠΑΡΑΚΑΤΩ . erwtasmeta	0
Η γωγω με λίγη φαντασία δεν μοιάζει με την Πέγκυ Ζήνα ShoppingStar	0
Γ XFactorGR	0
Πέρα από την πλάκα ... αυτές οι 5 ζουν ανάμεσα μας ... είναι επικίνδυνες ... gntmgr	1
Μήπως έχει καλεσμένο το Μενιο και είπε να βάλει τη κουμουτσα να τον κάνει να αισθανθεί φιλόξενα; kalytera	0
Πάντως ξεκάθαρα σε σκηνικά και κουστούμια το kokkinopotami κερδίζει κατά πολύ νομίζω τις Μέλισσες .	0
Στ αρχίδια μας	1
Τελικά τον είπες .. εκλογές Τσίπρας ΣΥΡΙΖΑ_ξεφτιλες	0
Είχα ξεχάσει πόσο σιχαμένη ειναι και πόσο με εκνευρίζει η μούρη της ! Και γελάει πανάθεμά την ! MasterChefGR_Xeftiles	1
Επίσης, πιστεύω ότι όταν υπάρχει τέτοια στοχευμένη επίθεση σε ένα άτομο με αποδείξεις, θα έπρεπε να επέμβαινε η παραγωγή και να απομάκρυνε τον υποκινητή και όχι να παρέμενε στο παιχνίδι, ειδικά όταν ήδη υπάρχει ξεκάθαρα κοινωνικό πρόβλημα με τους τραμπουκισμούς . gntmgr	0
Τελικά ο Σταύρος και κερατάς και δαρμένος στην κυριολεξία σε αυτή την σειρά . gynaikaxwrisonoma	0
Ερωτευμένη μόνο με την γάτα μου από εδώ και στο εξής . Τέλος οι μαλακες .	1
Η Μαρτίνα έδωσε πόνο-χτύπησε το αιδοίο της GntmGr	1
Δεν πα να 'χεις 28 πτυχία, 17 μεταπτυχιακά και 9 διδακτορικά, αν εισαι μαλάκας, μαλακας θα μείνεις	1
@USER μαλακας εισαι; περισσοτερα απο μενα βγαζει	1
@USER Τι ηλθια εισαι κοπελα μου; πραγματικα απορω .	1
ofipaok ρε μαλακες του ΟΦΗ στο Μάνο δεν είχατε πει τίποτε; Κοντεψε να ισοφαρισει	1
gntmgr η Κάτια θέλει να μας πείσει ότι κλαίει επειδή φεύγει η Σουζανα, και όχι γιατί πάλι κάτι σκέφτηκε άλλο για να κλάψει .για Όσκαρ το κορίτσι μπράβο	0
Το Βάγια απο πού βγαίνει; Απ´το Νικόδημος ! TheVoiceGR	0
Η Ηλιάνα Παπαγεωργίου προσκάλεσε την αδερφή της, στις οντισιόν του GNTM 2	0
Λωρειν ιζ μπακ shoppingstar	0
Τι θα γίνει σε ένα χρόνο Κούλης μπορεί να παίζει hollywood μαζί με Μαρέγκα και Ελλάδα θα είναι σε συνδιαχειριση με Τούρκους . Μαγεία μαλάκες εγώ θα την έχω κάνει σιγά μην μείνω στο μπουρδέλο σας θα πάρω γυναίκα και τον πούλο .	1
Ταριχευμενα τα εχει καλε τα ρουχα; shoppingstar	0
Επί ΓΑΠ απολύθηκα . Επί Σαμαρά και συγκυβερνήσεων τους ήμουν άνεργη, ανασφάλιστη, καταχρεωμένη . Αρχές του 2016,βρήκα δουλειά, και πλέον ζω αξιοπρεπώς .Δεν θα ξεχάσω ποτέ με ποιους υπέφερα, ποιοι μου έκλεψαν τόσα χρόνια από τη ζωή μου και ποιοι με έβγαλαν ξανά στο φως . ΝΔ_ξεφτίλες	0
Κακο σκυλί ψόφο δεν έχει AgriesMelisses TheVoiceGR	0
Αμάν βρε Ασημινα πίσω απο το χωράφι έλεος gntmgr	0
Καλα ποσο κανουν τα ρουχα ρε Παρις;shoppingstar	0
Οταν περιμενουμε απο ενα καταχρεωμενο κομμα να σωσει την καταχρεωμενη πατριδα μας ..μεταξυ μας τωρα, εχουμε θεματακι ND ΝΔ ΝΔ_ξεφτιλες ekloges2019	0
No hope ! O Βελόπουλος (δε τον ψήφισα) σας φοβίζει στα κανάλια ε; Ευρωεκλογες2019 Εκλογες_2019 ερχεται_ΠΟΥΤΣΑ Europawahl2019	0
@USER Κυριακή κοντή γιορτή,την επόμενη φορά θα είσαι κι εσύ μέσα μην στεναχωριέσαι,όλοι οι καλοί χωράνε ,εξάλλου τα βλαμμένα εδώ μέσα μία στο τόσο ανάβουν και μία φωτιά !	0
Εντωμεταξύ το απογευματινο ειναι πιο βραδινό απο το βραδινό πως παει ετσι η κυρια για μπύρα καλε ; shoppingstar	0
Παραλία του Ρίο όπου κάνουν μπάνιο φαυλόβιες γυναίκες: Σκρόφα Καμπάνα	1
@USER Ρε Κουλη σε ξέρουμε επειδή φαίνεσαι και μάλλον είσαι ίδιος με τον Mr Bean οχι με κάποιο χαρακτήρα του GOT	0
@USER Είσαι τόσο ηλιθιος που δεν καταλαβαίνεις πως γράφω για πλάκα ,,τόσος είσαι !️ και ο οίκτος μέσα στην ζωή είναι,ζαβουλη***,,,χάσου τωρα	1
Βάζεις τον πούτσο σου στη φωτιά για τον κόσμο ότι δεν είναι μαλάκας;	1
@USER Ειμαι της ιδιας αποψης . Οταν ομως μου εισαι στην πενα σε ολα .τ αλλα μην πρριμενεις να σε αφησω να .περασεις free πισω απο μενα Αντε μου κ σιχτιρια καπου δλδ	1
Έχει "προκόψει" κανένας βγαίνοντας απο το TheVoiceGR ; Πχ εγω δεν θυμάμαι ούτε τους νικητές ..	0
Εισαι κατάπτυστη τρεΛίλιαν GynaikaXwrisOnoma	0
Θέλω να στείλω τη Σουζάνα στην πατρίδα της να την κυνηγάνε τα λιοντάρια και να προσπαθεί να κανει πόζα fabulous GntmGr	1
@USER ΜΕΓΑΛΟ πτηνο κοιτα να είσαι, αλλιως μη λες πολλα	0
μοιάζει λίγο με Παπαρίζου στα πρώτα της ή εμένα μου φαίνεται;TheVoiceGR	0
Πρώτη φορά χαίρομαι τόσο που μετα από λεπτομερή έλεγχο δύο γυναίκες αποφάσισαν ότι το όργανό μου είναι αρκετά μικρό .. αεροδρομιο χειραποσκευη	1
Μια συμβουλή για όσους έχουν twitter ΜΗΝ ΜΠΑΊΝΕΤΕ ΟΤΑΝ ΕΙΣΑΙ ΕΞΩ ΣΕ ΚΟΣΜΟ ΘΑ ΤΟ ΜΕΤΑΝΙΏΣΕΙΣ	0
@USER Και χθες έλεγε στη γυναίκα του ότι δεν θα τον χάσει και θα ζήσουν μαζί όπως της υποσχέθηκε	0
Συμπέρασμα: α . Σκάστε μαλάκες συριζαίοι, δεν σας φταίνε οι κκεδες για την ανικανότητά σας (και είστε ηλίθιοι αν περιμένετε ψήφους από αυτούς). β . Σκάστε μαλάκες κκεδες . Σταματήστε να ακυρώνετε τα μικρά, συνεχίστε να διεκδικείτε τα μεγάλα (αλλιώς θα πάτε στο 3%)	1
@USER Ενώ ο Σύριζα τον έβαλε μέσα τον Εσκομπάρ .. Επι Σύριζα πήρε όλα τα ΜΜΕ έχοντας άπλετο χρόνο να κάνει την προπαγάνδα του και μόλις πριν λίγες μέρες το κανάλι του εκπέμπει κανονικά . Άσε τωρα τις δικαιολογίες, και εγώ Σύριζα ψηφίζω αλλά δεν είμαστε και μαλάκες .	0
