content	label
«Δεν έχετε λόγο να φοβάστε, είστε στη φύση»: Ανακόντα, Μαύρα Μάμπα, Λιοντάρια, Χιονοστιβάδες, Σκορπιοί, Πυρκαγιές . To name but a few . gntmgr	0
@USER Ευάρα μου είσαι Θεά, άσε να λένε	0
Περούκες από jumbo, ξεκάθαρα !gntmgr	0
@USER Τρεις τον π@USER κλαίγανε και δυο απάνω τούρλα . Ενωτικός με τους λάθρο, τους πουστηδες και τα τζιχαντια είναι και ο κουλης . Εκτος αν υπονοεί ότι ΝΔ και ΣΥΡΙΖΑ είναι ένα και το αυτό ... @USER	1
@USER Άσε μαλάκα, εσύ είσαι αυτός που έγραψε ότι η δολοφονία της Τοπαλούδη ήταν "απλά μια παρτούζα που πήγε στραβά" και κακώς ασχολούμασταν τόσο . Χώσου σε καμιά τρύπα και μην μιλάς .	1
Ο Κωστής είναι ο"γκαφατζής της ζούγκλας" του GynaikaXwrisOnoma	0
Το παντελόνι στα σκουπίδια το βρήκε; TheVoiceGR	1
δήθεν τα χάλασε η κυβέρνηση με τις τράπεζες για τις προμήθειες των 0,60 ερχεται πούτσα και θα ειναι πολύ μεγάλη θα ξεκινήσουν πλειστηριασμοί και για πρώτη κατοικία, ο κούλης το χαιβάνι δήθεν θα σηκώσει τα χέρια ψηλά και εμείς τα πόδια και ο θεός βοηθός .	1
@USER πω πωωωωω πανάκριβη είσαι	0
Γουινι εντ ρεμπα μπαντ τσικι τσικι μπουμ μπουμ xfactorgr	0
@USER συμφωνω .. αλλα καπως επρεπε να υπαρχει πλοκη για το εργο ! Κ εφοσον βασιζεται σε μια εξωσυζυγικη σχεση εκει θα στηριχτει .. λαθος, αλλα αυτο βλεπουμε να διαδραματιζεται ! erwtasmeta	0
Απ αύριο αντί για πάω να ταΐσω τις κότες, θα λέω ότι πάω για chicken keeping . gntmgr	0
gntmgr Μαρινάκη έρχεται η σειρά σου	0
Παιδιά βγάλτε τις καυλες σας εκεί στην Συρια και μην αγχώνεστε για τους πρόσφυγες εδώ είμαστε εμείς ...	1
@USER η Ντόρα μόλις δήλωσε ότι είσαι ΕΝΑΣ ΑΠΛΟΣ ΜΑΛΑΚΑΣ Έχεις να πεις κάτι να το επιβεβαιώσεις; κυρανακης κυβερνηση_τσιρκο	1
@USER Κομοτηνή ε; Εκεί που οι μουσουλμάνοι ψηφίζουν μουσουλμάνους, ψωνίζουν από μουσουλμάνους, πάνε σε γιατρούς μουσουλμάνους, σπουδάζουν τα παιδιά τους σε συντριπτικό ποσοστό στην Τουρκία και επιδοτούνται για να φοράνε τα κορίτσια κ οι γυναίκες τους το τσαντόρ; Αυτή την Κομοτηνή λέμε;	1
@USER Βλάβη για τη Δημοκρατία είσαι Ψαριανε .	0
Φέρτε κι'άλλους πρόσφυγες .	0
Εντωμεταξύ καθε τρεις κ λίγο δοαφημισεις που να ειχε και τηλεθέαση erwtasmeta	0
ψόφο στην παραγωγή και όσους σκέφτηκαν το κονσεπτ gntmgr	1
ΤΑ ΚΊΤΡΙΝΑ ΓΆΝΤΙΑ: "Πορτοκαλάδα δε θέτε, λεμονάδα δε θέτε, ΤΊ θέτε"; Όταν νομίζεις πως είσαι ο μαιτρ, αλλά τελικά είσαι ο Γκιωνάκης της επικοινωνίας .	0
ΓΈΛΙΑ ΑΠΛΆ gntmgr	0
@USER Υπαρχουν πολλοι μαλακες . Ο καθενας ομως ειναι ξεχωριστος .	1
Είμαι πανέτοιμη να δω το Γωγουλίνι σήμερα ...shoppingstar	0
Δίκη Χρυσής Αυγής: “Δεν είδα, δεν ξέρω, δεν διέταξα τίποτα” είπε στην απολογία του ο Μιχαλολιάκος δηλαδη να ποιοι ειναι οι ,,πορδοφασιστες τρομαρα τους ! μέσω του χρήστη @USER .gr	0
Δεκτή η αναίρεση της Δημητρίου για την άδεια Κουφοντινα . 3 μέρες και τελειώνουμε με αυτούς ερχεται_ΠΟΥΤΣΑ	0
Σουζάνα ένιωσες ένα τίποτα; Μπράβο είσαι στο σωστό μουντ ! gntm gntmgr gntm2019 gntm2	1
Σιγα μην δεν ειχαμε το ΣΝΙΑ κ την ΤΣΙΤΑ απο AdinamosKrikosgr στο kalomesimeraki ! Περιμεναμε σαν παλαβοι ! χαχαχαχαχαχαχα	0
@USER Εσύ δεν έχεις βιτρίνα Γιούλη μου αυτό που είσαι, αυτό γράφεις κ για αυτό είσαι Η φίλη μου !	0
Κλειστε τα ματια και φανταστείτε για ενα λεπτο ... θα μπορουσε να ηταν η δικη σας κορη αν ηταν θα ψηφιζες παλι Συριζα να εβλεπες τον βιαστη,τον δολοφονο της κορης σου να λιαζεται στην ομονοια οπως ελεγε η κυρα τασια Δεν ξεχνω την Μυρτω ειναι κορη αδερφη ολων μας	0
@USER Τα λεωφορεία με τους ρομα μην ξεχάσετε σύντροφε αλλιώς θα είσαι εσύ και ο τζανακοπουλος μόνο	0
@USER Ρε κόκκινοφασιστα δεν ξέρεις ότι και οι Πόντιοι πολέμησαν για την Μακεδονία; αλλά τι να περιμένω από το αριστερό μου αρχιδι; και αυτό για να έρχεστε εσύ ο φασίστας και να λες αυτές τις μπούρδες 100νκαι πλέον χρόνια μετά . Αχάριστος φασίστας αυτό είσαι	1
Η Άννα ήταν απτις άχρηστες χειρότερη, αλλά για μια ακόμα φορά θα παραμείνει στο σπίτι . Μας έχετε σπάσει τα νεύρα φέτος έτσι ; Μαζευτείτε εκεί στο GNTMgr μη καταλήξετε σα το Poweroflovegr . Μαλάκες	1
αν κανεις τον σουλτανο, εστω και σε ελληνικη σειρα, θεωρειται διεθνης καριερα; KokkinoPotami	0
η μαμα μου που ειναι σατανας, ειπε οτι η Μαρτινα μαλλον γκαστρωθηκε, γι αυτο φευγει, εξου κι η λιποθυμια gntmgr	0
GNTMGR . Καγιά στη κατια βγάλε τον κατάλογο από μέσα σου ουαου	0
@USER Γι αυτό λέω ότι δεν είσαι γλιτσας !	1
gntmgr ολες αυτες εχουν γκομενο αυτο	0
@USER εισαι ηλίθιος ολες τις ωρες, ή σου δινουν και ρεπό ;	1
shoppingstar το κοστούμι αυτό είναι σε αθλητικό στυλ(και πανάκριβο) και ήθελε αθλητικά,τα παπούτσια ωραία αλλά ήθελαν φόρεμα,γενικώς δεν ταιριάζει τίποτα με τίποτα	0
Τι θα πάθεις εάν βγει η ΝΔ και κυρίως εάν βγει αυτοδύναμη: - κόψιμο δώρων Πάσχα, Χριστούγεννα και επίδομα αδείας - ελαστικοτερες συμβάσεις - κατάργηση 5χ8 :40 ώρες την εβδομάδα - ετοιμάσου για 7 ημέρες ξεθεωμα με τα ίδια ακριβώς λεφτά , ειδικά εάν είσαι χαμηλόμισθος	0
Ποσο ζήλεψε η Κάτια την Καιζερ gntmgr	0
survivorgr Γαμιεται ο @USER	1
Ναι στα υπολοιπα οχι στο σορτς !TheVoiceGR	0
Η Νινα ισως η πιο ομορφη εκει μεσα ! Κριμα GNTMgr	0
Η κεισι και τα πουλιά της GNTMgr gntm gntm2	0
@USER Πόσοι τραγέλαφοι να χωρέσουν σ'ένα τσίρκουλο; Ακόμα και η γελοιότητα έχει ένα όριο, ακόμα και για τους ΝΔ_ξεφτιλες	0
-Μαρία μου είσαι divine . -Ντιβάνι είσαι και φαίνεσαι . gntmgr	0
χαλια βάφεται αυτη shoppingstar	0
Μανταμ σουσου Κατακουζηνου shoppingstar	0
χάλια η άνω γνάθος GNTMgr	1
@USER Δεν μαθαίνει ο Έλληνας Μόνο παθαίνει Νομίζω όμως ότι ο κόμπος έφτασε στο χτένι Εσείς οι γυναίκες πρέπει να μπείτε μπροστά Αυτό που συμβαίνει θα ψαλιδιζει σιγά σιγά τα δικαιώματα σας Οι υπόλοιποι αρωγοί	0
Γίνεται απόψε η επίσημη πλέον,ενθρόνιση της Βασιλικής οικογένειας,η οποία θα βασιλεύει έως 14 γενεές και όσο να σταματήσουν να παράγουν πρίγκιπες ! Συγχαρητήρια ελληνικέ λαέ που για ακόμη μια φορά απέδειξες πόσο φιλόπονος και δημοκράτης είσαι ! Καληνύχτα και αντίο @USER !	0
Η Ελευθερία, με το βλέμμα του ροφού, θα έπρεπε να φύγει σήμερα, αλλά με τόση μιζέρια και μιρλα σήμερα, στάνταρ θα της χαριστουν παλι gntmgr	0
@USER Ντροπή σ .εισαι μεγάλη ξεφτίλα εδώ μέσα .τπτ αλλο	1
Βραζιλία είσαι η καλύτερη ! SUGA	0
Ηρωας είσαι αγόρι μου,ηρωας poweroflovegr skaipolixeftiles	0
Σε ποιο πολιτισμενο, "δυτικό" κράτος μωρέ μαλακες έχουν δικαίωμα εκλαιγεσθαι τύποι που πετάνε σεξιστικα υπονοούμενα για καθαριστριες και δε συμμαζεύεται και αρχηγοί κομμάτων που δηλώνουν ανοιχτά ότι "τις περισσότερες δουλειές στο σπίτι τις κάνει η νοικυρα";	1
Μέλι στάζει ο Μπρατης kalomesimeraki	0
@USER Μια χαρά βαράνε γυναίκες . Αλλά για την συγκεκριμένη θέλει 5-6 από αυτούς για να αποκτήσει ενδιαφέρον . Βλέπω βέβαια λες σε ενοχλούν και τα δύο άκρα αλλά αμέσως να υπερασπίσεις την τιμή του δικού σας άκρου . Περίεργο .	1
@USER Το να είσαι δήμαρχος δε σημαίνει ότι πρέπει να είσαι συνέχεια στο δήμο σου ...έλλειπε αρκετές φορές σε δουλειές για το δήμο στο εξωτερικό ..απ' όσο θυμάμαι στη φωτιά στο Μάτι, τα ΜΜΕ κυνήγαγαν τον @USER, ενώ ο ίδιος απέφευγε να κάνει δηλώσεις πριν διευθετηθει το θεμα .	0
Όταν έχει πιει τον κωλο σου και ψάχνεις ταξί για να γυρίσεις σπίτι gntmgr	0
*Άνισα τρίγωνα και τρισδιάστατα μοτίβα* πρέπει να το πω στα κορίτσια ...ΠΑΝΑΓΙΑ ΜΟΥ ΦΟΝΙΚΟ gntmgr	0
Θεός ο Μάστορας στο XFactorGR , 'αν θες να μάθεις κάποιο τραγούδι, το ακούς από τον Γιώργο Νταλάρα '.	0
συγγνωμη η κατια δεν ειπε στο προηγουμενο επεισοδιο για τις γυναικες οτι πρεπει να σταματησουν να κλαινε και να δειχνουν συνεχως συναισθημα; gntmgr	0
Μόλις διάβασα ότι η Σπυριδούλα δηλώνει : "Είμαι η Ελληνίδα MasterChef, απλώς δεν πήρα τα λεφτά". Άσε μας κουκλίτσα μου πΧΧια ... Ο Χρήστος είναι ο νικητής κ ο Μανώλης πήρε τα λεφτά . Εσύ είσαι απλώς δεύτερη MasterChefGR	0
shoppingstar Γωγώ και Άρτεμις είστε κομπλεξικές ....τελευταίες θα βγείτε .. Η κοπέλα είναι μια χαρά	1
Καλώς τα αρχίδια μας τα δυό .	1
ΝΟΕΜΒΡΗΣ ΜΠΗΚΕ αλλα εμεις αποψε παμε ταξιδακι με στο GNTMgr σ ενα νησι ! Ποιο αλλο;	0
η Κατια σημερα εδωσε τη πρωτη της παρασταση/δραματικη σκηνη ... μιας και της αρεσει η ηθοποιια, ξερουμε ποια του χρονου θα παιζει σε θεατρικο (οπως καζαριαν), ειπε σημερα να κανει μια ατυπη οντισιον το κοριτσι . gntmgr ΦΕΡΤΕ ΤΑ ΜΠΑΦΤΑ, ΦΕΡΤΕ ΤΑ ΟΣΚΑΡ	0
Η αδερφή μου ήταν εφορευτική επιτροπή χθες . Πήγε ένα 17χρονο της δείχνει το λευκό και τη ρωτάει αυτό γιατί είναι λευκό και αν το έδωσε κατά λάθος ή αν ξέχασαν να το τυπώσουν .	0
Αν η Λορειν κατέβει στις εκλογές στην Αγγλία η Μει θα φάει τη σκόνη της .. ShoppingStar	0
Μωρη Ασημίνα το ύφος που έχεις όταν μιλάς με τις φίλες σου δεν μπορούσες να το βγάλεις και στη φωτογράφιση; Την καλύτερη φωτογραφία θα είχες GNTMgr	0
@USER Ος μαλακας ενωεις; Το πολυ το τακα τακα δες πως καταντησες χαχαχα	1
μικρος και τριανταφυλλενιος erwtasmeta	0
@USER Σύντροφε δεν ρώτησα τι είσαι εσύ . Άλλο ρώτησα . Τώρα, αν απλώς ενημερώνεις δημόσια ότι είσαι μαλάκας, καλά κάνεις αλλά δεν με ενδιαφέρει .	1
Είμαι σε εκλογικό τμήμα που ο δήμαρχος βγαίνει κάθε φορά με 65%. Γίνεται χαμός από κόσμο, σαφώς περισσότερο από τις προηγούμενες εκλογές . ερχεται_ΠΟΥΤΣΑ; Ευρωεκλογές2019	0
@USER Είσαι αναρχοβιόλης !	1
@USER Οχι η λογικη μου είναι βαζω μπατσους να κοβουν κλήσεις, υπουργούς να πετάνε μαλακιες και τρολακια με φωτο σκυλου να ζαλίζουν τα αρχιδια οποιου λεει πόσο τσίρκο ειμαι . Αντε τραβα τωρα	1
Η Σημερινή μου Εκλογική εμπειρία συνοψίζεται ως εξής: Veni,Vidi,Vici ! Για όσους δεν ξέρουν Λατινικά Σημαίνει: Ήλθον,Είδον,Ενίκησα ! EUelections2019 ekloges2019 ερχεται_ΠΟΥΤΣΑ ΣΥΡΙΖΑ εκλογες_2019	0
@USER Σωστός είσαι εδώ ._	0
Κάτι μουνια από την ΝΔ πειράχτηκαν με τις μπυρες και τα σουβλάκια .	1
Ο Γεωργαντας πάντα τόσο βλακας ήταν ή τώρα το έχει πάθει; και αυτή την εκπομπή τη βλέπει κανείς; και αν τη βλέπει έχουν τόσο ενδιαφέρον τα σεξουαλικα των τάχα μου "σελεμπριτις"; giatinparea	1
Μια μικρή υπενθύμιση στη Κάτια που δεν κάνει Bullying GNTMgr	0
Οι Ευρωεκλογές2019 λαμβάνουν χώρα αυτή την εβδομάδα ΕΣΥ είσαι μέρος τους ! Χρησιμοποίησε ThePowerofVote για μία Ευρώπη που θα εγγυάται προστασία, ελευθερία, αξιοπρέπεια ισότητα για όλους, συμπεριλαμβανομένων προσφύγων μεταναστών, ενάντια στο ρατσισμό και την ξενοφοβία .	0
@USER ΛΙΠΟΝ ΣΑΣ ΒΑΡΕΘΙΚΑ ΜΟΥ ΠΡΙΞΑΤΕ ΤΟ ΜΟΥΝΙ ΣΑΣ ΔΙΑΓΡΑΦΩ ΑΝΤΕ ΚΑΙ ΓΑΜΗΘΗΤΕ ΑΛΟΔΑΠΟΙ !	1
Ξέρουμε ποια θα φύγει; gntmgr	0
Πολύ σωστά το αποφάσισε τη Ρία, άν το εννοεί . gynaikaxwrisonoma	0
Να φύγουνε οι πρόσφυγες να μας μεινουνε τετοιοι θρασύδειλοι καριόληδες	1
@USER οι γυναικες το μισουν ...	0
Άει τραβάτε στο διάολο, είναι εκνευριστικό, αυτό το πράγμα δε βλέπεται . Λίγη ντροπή ρε πούστη μου, αυτό δεν είναι μπάσκετ Ευρωλίγκας, αυτό είναι συνωθύλευμα . olyefs OlympiacosBC	1
@USER Μαλάκας ..	1
@USER Καταλαβαίνουν, τι γράφω ! Αρέσουν και στην αδερφή της αυτά !	0
Η μονη περιπτωση να πει καποιος τη λεξη ΣΤΑΡ στο Γωγουλινι,ειναι οταν μιλαει αυτη για μοδα και της λεει:"ΣΤΑΡ-ΧΙΔΙ@ ΜΑΣ Γωγουλινι !" shoppingstar	1
@USER Είμαι πολλά και διαφορετικά πράγματα ταυτόχρονα, φίλε μου . Γελώ που νομίζεις ότι το να είσαι Ελαμίτης είναι χειρότερο από το να είσαι με οποιοδήποτε άλλο κόμμα της Κύπρου .	0
Αυτό το μεταπτυχιακό τι το ήθελα γριά γυναίκα πάτωσα και στο διαγώνισμα	0
δεν την καταλαβαινω την παραγωγη του poweroflovegr ...εχει μεσα 30αρηδες κ βαζει κ εναν 36αρη κ απο γυναικες βαζει μια κοπελα 21 χρονων	0
gntmgr η Ασημίνα γιατί μπήκε στο παιχνίδι κ γιατί είναι ακόμα εκεί;	0
gntmgr Όταν δεν διάβασες και η δασκάλα σου λέει να πεις μάθημα ..	0
@USER Οταν εισαι το ζωο που σε δουλευει το πρωην δεξι χερι του Τζοχατζοπουλου, η δολοφόνος 127 συνανθρώπων σου και αυτη που επελεξε να συγκυβερνήσει με τους χουντικοφασιστες ΑΝΕΛ και ζηταει συγκλιση με την ΧΑ ,ειναι τραγικο .	1
3 .500 πρόσφυγες και μετανάστες στην Ήπειρο .. Όλοι οι φορείς σε κοινή σύσκεψη	0
@USER Εδω Θεσσαλονικη πάντως στο κέντρο οσο προσεκτικός και να είσαι πρέπει να είσαι και τυχερός πλέον	0
@USER Είσαι τόσο αγνά, ανόθευτα καθυστερημένος	0
Το "είσαι τρόμπας" θεωρείται κοπλιμέντο στο masterchefgr;	0
@USER 3 μηνες επαιζε με τα θερια σοβαρα μιλας; Φετος ξεκαθαρη αδικια για τους ελληνες άντρες για να φανουν οι τουρκοι ολα στο σενάριο του ατζουν	0
@USER Το εχεις τερματισει . Σε παρακαλω βαλε τη μαντιλα να καλυπτει ολη σου τη δατσα . Αν δεις κ δεν μπορεις να ανασανεις μετρα μεχρι το 100 κ ψοφα	1
Για τον ΣΥΡΙΖΑ ο προοδευτισμός έγινε συνώνυμο της λέξης αναρχισμός ! Σε ποια χώρα της υφηλίου οι πρόσφυγες και οι μετανάστες από την στιγμή που πατούν σε μία χώρα ορίζουν τον πολιτισμό και της παραδώσεις μιας χώρας ! Αν αυτός είναι ο προοδευτισμός να τον χαίρεστε !	0
Αντε παρε ποδι τοτε Καργια και δειξε την αξια σου εξω απο το σπιτι που εκλασε η Ζιζελ και νομιζεις οτι βγηκες εσυ gntmgr	1
Αχ πέσατε από τα σύννεφα οι κριτές . Δεν το ξέρατε .. gntmgr	0
@USER Εσυ είσαι το κοινό της ;	0
@USER Όχι δε φταις . Αυτό ακριβώς εισαι . Ότι κι ο Πλεύρης ...	0
Έρχεσαι Αγγλία και βλέπεις όλη την τρασίλα και λες ενταξει ρε συ δεν είμαστε το ίδιο τι να κάνουμε . Μετά βάζουμε τον Βελόπουλο στην ευρωβουλή και λες καλός μαλακας είμαι γαμω την Ελλάδα, τη σημαία και ότι βγαίνει σε μπλέ .	1
Ασημίνα μη ζηλεύεις τόσο μωρη gntmgr	0
Η επικράτεια της ηρωίνης: Ιδού τα χάλια και τα αποτελέσματα της αμάθειας, της προπαγάνδας και του επιτυχούς πειράματος της 'μεταδημοκρατίας'. Αν δεν βάλουμε μυαλό, πράγματι έρχεται_πούτσα, όταν όμως σαρώσει η λαίλαπα των ΝΔ_ξεφτιλες θα είναι αργά για επανόρθωση ...	0
ΑΛΛΟ ΕΝΑ ΠΟΛΥ ΠΙΟ ΚΑΛΥΤΕΡΑ ΝΑ ΠΕΙΣ ΘΑ ΕΡΘΩ ΕΚΕΙ ΝΑ ΣΕ ΤΑΙΣΩ ΤΗΝ ΕΛΛΗΝΙΚΉ ΓΡΑΜΜΑΤΙΚΗ GNTMgr	0
Εν τω μεταξύ το thevoicegr αν δεν το χε τέτοιες μέρες που δεν έχει τίποτα η τηλεόραση, ούτε ένα επεισόδιο δεν χα δει	0
@USER Τι μαλακας εισαι ρε !	1
@USER Τους τα έχω πει όλα σαν τους μαλακές κοιτάνε ! Η πλάκα είναι ότι δεν θέλουν να δκυελυεουν αλλά τους ενοχλεί που χώνουν εμένα	1
@USER σίχαμα είσαι . Και φαίνεσαι . Το σχοινί στο οποίο περπατώ για να κάνω τη δουλειά μου μόνο από κάτω το θωρείς . Υποθέτοντας τι βλέπεις, καληνύχτα	1
@USER Είσαι αστείος !Καλή τύχη !	0
Νωρις το καταλαβατε οτι δεν κανει η Σουζανα GNTMgr gntmgr	0
@USER Σε ευχαριστώ πολύ να είσαι καλά επίσης Μαρία !	0
MasterChefGR MasterChefGR_Xeftiles ποσό στημενο;	0
ΑΣΗΜΊΝΑ ΒΟΥΛΩΣΕ ΤΟ ΚΑΚΑΣΧΗΜΗ gntmgr	1
ΩΧ ΑΜΆΝ ΣΤΕΙΛΑΝΕ ΤΗ ΖΕΝΕΒΙΕΒ ΝΑ ΔΙΑΒΆΣΕΙ ! ΛΟΛ gntmgr	0
Νομίζω ότι ο πιο κατάλληλος χώρος για το gntmgr ήταν το «Δελφινάριο», όχι το Θέατρο του Πειραιά .	0
Κρασί κ καφέ μαζί ; Άιντε άιντεεεεε erwtasmeta	0
ειχα ενα ζευγαρι φιλους . Του λεει η αλλη μπροστα μας "Δουλεια βρηκες ;" "Αρχιδια βρηκα", λεει ο δικος μου . Ουτε απ αυτα βρηκες . Αν ειχες αρχιδια δε θ αφηνες τη γυναικα να πληρωνει ! Ακομα ειναι φιλοι μου αλλα δεν ειναι ζευγαρι	1
@USER Στα ποτά και στις πουτανες .	1
XFactorGR LGTB τον εκαναν τον ροκά;	0
Λορέιν, ΕΙΔΩΛΟΟΟΟΟΟΟ προσκυναμε . shoppingstar	0
Θέμη μου όταν μπορέσεις χώσε καμιά σφαλιάρα στον Ζαχάρωφ kokkinopotami	0
@USER Εσύ είσαι μικρος	0
@USER Εισαι μαλακας αγόρι μου	1
Ναι μωρή Καιτουλα αρρώστια	0
@USER εισαι μονος και φαινεται	0
Η σημερινή η Δέσποινα έπαιζε στο θέμα "Μια κυρία στα μπουζούκια" και είναι από τις διαγωνιζόμενες που ξεκάθαρα αδικήθηκαν . Έπρεπε να βγει νικήτρια τότε ! shoppingstar	0
Κανέναν άλλον θα μας δείξουν σήμερα ; erwtasmeta	0
Ο καινουριος βρωμαει απο χιλιομετρα μπουρτζοβλαχος καγκουρομαγκας χαζοναρκισσος . Αλλα ευτυχως μας ξεκαθαρισε οτι ολες τον θελουν κι αυτος τις αφηνει και γλυτωσαμε την καψουρα του PowerOfLoveGR	1
Καλησπέρα στην παρέααα kalomesimeraki	0
