content	label
ΡουβίκωναςBank ΜπαχαλοΔάνεια Σε πιάσανε με τ γίδα στην πλάτη; Έχεις ανάγκη από ζεστό χρήμα για να αποπληρώσεις εγγύηση αποφυλάκισης; Έλα τώρα στην ΡουβίκωναςBank εμείς θα πάμε στο ATM κ θα σου δώσουμε το δάνειο που χρειάζεσαι μέσα σε 48ωρες αρκεί να είσαι μέλος μας Ρουβίκωνας	0
Μανώλη το κραγιόν που σου έβαλαν δεν πάει με το στυλ σου ... Από εμένα είναι ΟΧΙ masterchefgr_xeftiles MasterChefGR	0
- Συναίλυνες, ήρθαν τα πούλμαν . Πίσω μωρή βρωμιάρα μουσουλμάνα που φοράς μαντίλα για να λες "Αλλαχού Ακμπάρ". - Ρε δικές μας είναι αυτές, φοράνε μαντίλες γιατί πάνε να προσκυνήσουν σε μοναστήρι . - Ο Θεός είναι Μεγάλος . Καλόν δρόμο, ευλογημένες . Σώσον Κύριε τον Λαό Σου .	1
Η αδερφη μου μολις μου ανεθεσε να κανω λιστα με παραδοσιακα και καποια "κλασσικου τυπου" τραγουδια για τον αρραβωνα ..... το "Ανοιξε Πετρα" εντασσεται στις κατηγοριες για πειτε μου λιγο που με καιει .... -.-	0
Εντάξει μωρέ μπρος στην κανονικότητα τι είναι και 500 ευρω τον χρόνο ε; ε; ε; ε; τι_ψηφίσατε_ρε_μαλάκες κυβερνηση_τσιρκο	0
Σαχλοκούδουνο Ιόλη νούμερο 2 η καινούρια; skaipolxeftiles poweroflovegr	1
@USER Ας πρόσεχαν κι αυτοί νδ_θελατε	0
Το τέλος φρίκη . το ο συνεχόμενο ζόρι; XFactorGR	0
Κι άααλλη Κανονικότητα ..."Κλείνει η Κλινική ΩΡΛ στο Παίδων Πεντέλης . Με ευθύνη του υπουργείου Υγείας - Κενά σε πολλά νοσοκομεία από την ακύρωση 208 μόνιμων διορισμών". ΝΔ_θελατε ΝΔ_ξεφτιλες κυβερνηση_Μητσοτακη	0
@USER Επιτελους καποιος που με αναγνωριζει στο # χαχαχαχαχα Συγκινηθηκα ρε συ !εισαι η καλυτερη !	0
Η Μάρθα με τον Φώτη χωριζουν σαν να ήταν ζευγάρι . Εντωμεταξύ μια φορά κοιμήθηκαν μαζί και δυο φάγανε . GynaikaXwrisOnoma	0
Εσυ είσαι του @USER, που να σε ακουμπήσουμε;	0
@USER και στα ραν το φωναζει . το ειπε και ο Μπορα . οποιος παιζει μαζι μου του φωναζει εισαι ο καλυτερος . δεν μιλαγε για τις ηττες του . αλλα γενικα με οποιον τρεχει μαζι του	0
η ερωτηση ειναι γιατι δεν του κανεις τη χαρη gntmgr	0
@USER Κ ΜΕΝΑ ! Η ΜΑΛΑΚΩ !	1
εγω ΔΕ θα πληρωνα να δω τη Καγια να μου ποζαρει GNTMgr	0
Σε επίπεδο ρεπορτάζ, η παραμονή Βαρέλα είναι από τις ωραίες ιστορίες . Τα είχε όλα . Εγωισμοί, παρεξηγήσεις, σπασμένα τηλέφωνα, μούτρα, παιδιά, γυναίκες, ατζέντηδες, προτάσεις, σκάιπ, συναντήσεις, πολύ μπλαμπλα .	0
Ξεσήκωσε τα μαγαζιά η εθνική μάνα .. GynaikaXwrisOnoma	0
GynaikaXwrisOnoma έτσι που κάθεται η τουμασατου στους καναπέδες θλιμμένη μου θυμίζει τη Ρεγγίνα στη βέρα όταν ήταν έγκυος που όλο ήταν έτσι να σκέφτεται το Στρατο	0
@USER ΑΥΤΟΙ ΠΡΑΤΤΟΥΝ ΚΑΙ ΕΜΕΙΣ ΟΥΤΕ ΜΙΛΑΜΕ ΕΑΝ ΑΥΤΟ ΔΕΝ ΕΙΝΑΙ ΚΑΤΑΝΤΙΑ ΤΩΝ ΠΟΛΙΤΙΚΩΝ ΜΑΣ ΤΙ ΕΙΝΑΙ ; ΣΟΥΠΕΡ ΞΕΦΤΙΛΑ ΤΟΥΣ ΕΝΔΙΑΦΕΡΕΙ Η ΚΑΡΕΚΛΑ Η ΕΞΟΥΣΙΑ Η ΚΟΥΤΑΛΑ ΜΕΤΑ ΘΑ ΠΟΥΝ ´´ ΜΑΖΙ ΤΗΝ ΧΑΣΑΜΕ ΤΗΝ ΘΡΑΚΗ ´´	0
ΣΟΚ Η Ελεανα αποκαλεσε το ρουχο του Μπρατη ΡΟΜΠΑ , μες στα μουτρα του ... gntmgr	0
@USER να ξέρεις πάντως πως αν βγεις να πεις μια κακή κουβέντα για το τσοκαρο, εμείς δε θα παρεξηγηθούμε ...ούτε θα σε κατηγορήσουμε .. MasterchefGr_xeftiles	1
Μαρια πλακωσε ατο ξυλο την Σουζανα !GNTMgr	0
ΟΥΤΕ ΝΑ ΜΟΥ ΤΟΝ ΔΕΙ ! shoppingstar	1
Ελα μωρη θεαρα Σπυρουλα ! GNTMgr	0
@USER Βοήθεια και γρήγορα δεν πάνε μαζί . Ελλάδα είσαι .	0
Ο Χατζηνικολαου θα την αφήσει την γυναίκα να μιλήσει ; EnwpiosEnwpiw	0
Το οτι ειμαστε γυναικες και (μπορουμε να) κλαιμε ειναι οκ, ωραιο . Οταν εχεις ενσωματωθει με τα εμφυλα στερεοτυπα και ουτε καν το εχεις αντιληφθει . GNTMgr	0
Πω ρε ψώνιο Κάτια . Ηρέμησε και ξεκαβάλα GNTMgr	1
@USER Και να μην είσαι υποψιασμένος μόνο το κείμενο να διαβάσεις που παγώνουν οι υπογραφές λόγω των εκλογών για κλειστό γήπεδο 15 .000 θα πέσεις κάτω από τα γέλια	0
Έφυγε ξανά ! GNTMgr	0
Η ολγα ποτέ δεν μ άρεσε ιδιαίτερα αλλά τι ποδάρες είναι αυτές ρε φίλε gntmgr	0
@USER Μαλακες ειναι να παρουν τους ανηλικους με μουσια οπως κανουμε εμεις;...για κοιταξτε στη Σουηδια που τους ψαξανε την ηλικια με DNA να δειτε οτι το 75% ηταν ανω των 18 ,ελεος με τη προπαγανδα σας,καντε τη πλεον μονο στο τουρκοκαναλο σας ...!	1
Μονο να κανει κανενα μπαμ η μουσικη οταν αποκοιμηθώ gntmgr	0
@USER Καλά ξεκουμπιδια ρετάλια ξεφτιλες .χολερα ουστ	1
@USER Ακρωτηριασμός κράτους κ στρατός κατοχής . KFOR Εν τω μεταξύ οι ξένοι Υπήκοοι, ΟΗΕ ΕΕ, κτλ απολαμβάνουν άπειρα λεφτά σε μια φτηνή αγορά ξυνοντας τ αρχίδια τους . Στα καταστήματα κ καφέ που μαζεύονται είναι μονίμως μεθυσμένοι κ οι κόκα τρέχει άφθονη ..	1
Άλλο ένα δολοφονημένο τραγούδι kalomesimeraki	0
shoppingstar Η Λορειν παλι εβαλε κατι λιτο και απεριττο και βγηκε μεσημεριατικα τι βλεπουμε σημερα	0
Εγω θα κρατουσα την Ζωη-Μισελ γιατι η αλλη κοπελιτσα εχει σχολειο ακομη XFactorGR	0
Προσεύχονται στ' αρχίδια του Διός και στο παπάρι του Πανός !	1
Πες μωρή ότι είσαι σκατόψυχη GNTMgr	1
Πολύ μέτρια ρούχα κύριε Μπράτη μας,επιπέδου κουδουναρη ..ρούχα που ρίχνουν σαγόνια έχουν Κριθαριώτη,MI RO,βρετος Βρεττάκος ..από μένα είναι όχι gntmgr	0
Είδα τρέιλερ και είδα και Έλενα ...Μεγαλο τσουλακι . poweroflovegr	1
Oι νεκροι απο φωτιες επι ΝΔ ειναι ασυμμετρη απειλη Επι Συριζα ειναι εγκληματικη αμελεια Οι προσφυγες επι ΝΔ ειναι ασυμμετρη απειλη Επι Σύριζα τους καλει η Τασια	0
@USER Αυτό κατάλαβες; Όταν έβγαιναν τα fakenews δεν έκαναν τίποτα . Τις έλεγαν πουτάνες, τους έλεγαν κλέφτες και δεν αντιδρούσαν . Σε παρακαλώ . Άτολμοι όλοι τους .	1
Giatinparea για χαλάλι	0
Διαβάζω οτι ο Μπογδάνος θα είναι υποψήφιος της ΝΔ στις εθνικές εκλογές . Πολύ επιλεκτικές διαγραφές κάνει ο Μητσοτάκης . Άρα έχουμε, Μπογδάνο, Αριστοτέλη Αιβαλιώτη, Άδωνη Γεωργιάδη και στην πηγάδα ο κακομοίρης ο μαλάκας που έγραψε το ποστ για την Κούνεβα . Ωραίο ψηφοδέλτιο .	1
@USER καλέ αστράφτεις, εγώ 6 μήνες πήρα και από κώλος της μαϊμούς έγινα κώλος της μαϊμούς αλλά χωρίς σπυριά	0
Η ανώμαλη η γυναίκα θα τρέξει πίσω από αυτόν που την γράφει στα παπάρια του γνωστό αυτο	1
πολυ της παει αυτο το στυλ τηςΑννας Μαριας οντως ...και η παπια αψογη GNTMgr	0
@USER Εισαι βλάκας; Απλά ρωτάω .	1
Τωρα δε λενε κουβεντα η Σουζανα τελεια gntmgr	0
Για πρώτη φορά φέτος δεν με τραβά να δω τον τελικό ! Προτιμώ να δω το ρεπορτάζ του BBC για το Brexit masterchefgr_xeftiles	0
@USER My personal cell ... 4165233 και πάρε τ’αρχίδια μου ... πόσο ανήκε	1
"Με όλα τα πουλιά τα πάει καλά η Κέισι" Άννα-Μαρία 2019 μ .Χ gntmgr	1
@USER Αντε γαμησου ρε μπαγλαμά ... Να μπολιαστεις εσύ κ η οικογένεια σου, εμείς δεν θέλουμε	1
@USER ΧΑΧΑΧΑΧΑΧΑΧΑ χαχαχαχαχαχαχαχαχα χαχαχαχαχαχαχαχαχα . Όταν τα λέγαμε στους νδες τι είσαστε μας λεγανε ακραιους . Φατε τωρα μπλε αριστερα μαλακες μου .	1
Τραγικοί όλοι, οι γυναίκες του πάνελ ακόμα χειρότερες . mesimeri_skai	1
Η Κάτια από στρίγγλα σε αρνάκι μέσα σε ένα επεισόδιο ! Χεστηκε πάνω της η πραγματική κότα του σημερινού επεισοδίου ! gntmgr	0
Ρε παιδιά εκεί στην ΝΔ_ξεφτιλες, εδώ ο δικός σας φοβάται να πάει σε debate με τον Τσίπρα, πώς θα πάει να διαπραγματευτεί με τη Μέρκελ και τους ευρωπαίους;	0
Το χρυσό συμβόλαιο με την stock glich gntmgr	0
Μέρες τώρα βασανίζομαι και αναρωτιέμαι .. Είμαι σταθερά μεταβαλλόμενος ή μεταβλητά σταθεροποιημένος μαλάκας;	1
«Η Κέισι το έχει με όλα τα πουλιά !». (Ναι, έτσι όπως ακούστηκε ...) gntmgr	0
ΑΝΤΕ ΓΕΙΑ ΚΑΡΧΙΑ ! ️ MasterChefGR_final MasterChefGR masterchefgr_xeftiles	0
@USER Μπράβο του . Πονέστε προδότες, έρχεται_πούτσα !	0
Η ζωή του Λιάγκα ολη: τον βλέπουν όλοι και αλλάζουν δρόμο kalomesimeraki	0
Η κοτα εκανε το αυγό ή το αυγό την κοτα; gntmgr	0
Οι άντρες πήγαν να οργανώσουν τις κοπέλες επειδή είναι άντρες;! Θα τρελαθώ ! Ουτε πριν εκατό χρονια σε χωριό αποκομμένο από τον κόσμο να ήταν ! survivorgr	0
Οτι και να τους βαλετε στο στομα δεν θα καταλαβουν διαφορα GNTMgr	1
@USER Συμφωνείς; Περίμενα να πεις «έχε πίστη στον εαυτό σου», «δεν είναι έτσι», «είσαι υπερβολικό». Τεχνική αντίστροφης ψυχολογίας !	0
Ο Ηλίας ο πτηνό ....πουλος ! gntmgr	0
@USER Ασχετο ότι να ναι, δε με ενδιαφέρει γιατί πρώτον δεν σε ξέρω, δεύτερον δεν έχω ιδέα εσύ τι πιστεύεις και ψηφίζεις, και τρίτον είσαι απλά ένα ενοχλητικό ακάου στο τουιτερ, ψιλοτρελαμένη που έρχεσαι κάθε τόσο να λες μαλακιες	1
@USER Τώρα κρέμασμα στην πουτανα .	1
ρε εσυ καγια ειλικρινα της πιστευεις αυτες της μαλακιες που λες ... shoppingstar	1
@USER Η μοναδική μακροπρόθεσμα βιώσιμη λύση είναι κλειστοι χώροι υποδοχής . Τα ξενοδοχεία τα επιδοτούμενα ενοίκια και η βοήθεια είναι για τους χαρακτηρισμένους πρόσφυγες όχι για τους λαθρομετανάστες	0
Έπρεπε να βάλουν μια περούκα στην Σουζάνα GNTMgr	0
Lost AX μωρή αρρώστια μου	0
shoppingstar Διορθώνει το γωγουλινι άλλον άνθρωπο; ζήσαμε να το δούμε και αυτό ...	0
Η Μελίνα εξελίσσεται σε παιδεραστρια XFactorGR	1
@USER Τα νιάτα σου λές κ τώρα είσαι γριά	0
Ιππότες που αποκαλούν τις γυναίκες γκόμενες και αληταριά που φέρονται σε όλες σαν κυρίες	0
-Γιατί δεν απαντάς στο μήνυμά μου μωρή; -Είναι απεχθές ! -Ακριβώς, απ' εχθές στο έχω στείλει και με γράφεις !	0
Ιβαν δεν επραξες σωστα . Εισαι χεστης . πουτανΕλλη gynaikaxwrisonoma	0
Ξέρετε τι λείπει απ το gntmgr ; Ο Ανδρέας Μικρούτσικος	0
Βγάλτο μωρή το ριγέ σαν κατάδικος είσαι shoppingstar	1
@USER Να μου πεις ναι για να σε πω πουτανα	1
Σκούρη γλειφτη γαμιεται η μάνα σου	1
Ακόμα και το 1900φευγα υπήρχαν μαλακες που άφηναν την κοπέλα που ενδιαφέρεται για αυτούς στο ‘διαβάστηκε’, βλέπε Μιλτος . kokkinopotami	0
Ειμαι σαν τον αστυνομο στο κων/νου και ελενης . Τη γυναικα τη θελω και παρθενα και πουτανα .	1
Η Ασημινα θέλει να κερδίσει κιόλας ; gntmgr	0
Άρη μπράβο ! TheVoiceGR	0
GntmGr ΤΙ ΣΕΞΥ ΚΑΙ ΚΙΝΚΥ ΓΤΧΜ;ΑΥΤΟ ΤΟ ΚΑΡΑΤΖΟΥΚΟΥ ΤΟ ΒΛΕΠΕΙ ΚΑΙ Η ΑΝΗΨΙΑ ΜΟΥ ,7 ΧΡΟΝΩΝΕ	1
Ακολουθεί τουί -μικρό θρέντ, προσωπικής μου απόψης , την κατανόηση σας, που μου ήρθε βλέποντας τα πρώτα επεισόδια από το kokkinopotami	0
Πότε θα με πάρει κάνα τηλέφωνο η μαλακισμένη και θα με πλακώσει στα μπινελικια και θα έχει και δίκιο	1
@USER 1 . Ειναι ΛΑΘΡΟΜΕΤΑΝΑΣΤΕΣ ΙΣΛΑΜΙΣΤΕΣ ΕΓΚΛΗΜΑΤΙΕΣ ΤΕΜΠΕΛΧΑΝΑΔΕΣ 2 . Φυσικα και είναι με ΔΙΚΑ ΜΑΣ ΕΞΟΔΑ, και ΣΕ ΒΑΡΟΣ ΗΜΩΝ 3 . Γαμώ το μουνί της σκύλας της πουτάνας μανας που σε πέταξε, γαμώ και τον αλλάχ σου παράσιτο βρωμοτρολ !	1
Κωνσταντίνε και τα καλαθάκια να αδειάσεις από το μπάνιο erwtasmeta	0
ekloges19 η πρωτη φορα αριστερα εφερε πρωτη φορα αλλοδαπα στο νομο ροδοπης, "μπραβο" ελληνες που ειχατε βγαλει τον αλεκση το 2015, παλι καλα αλλαξανε τα μυαλια το 2019 ekloges2019 survivorGR ηρθε_και_ηταν_μεγαλη giatinparea ηρθε syriza_xeftiles	0
Βίκυ "Ζιμπαν ζιμπαν αλουλου" Καγια gntmgr	0
τι είχε κάνει αυτός ο Πολύκαρπος; kalomesimeraki	0
Κλαίω με το σποτάκι . Εξαιρετικό giatinparea	0
@USER Εσύ είσαι η κυρίως υπεύθυνη Λολαλό .Και το γνωρίζεις .Και υπεκφευγεις .Παλι .Οπως τότε .	0
Και στην τελική φεύγει η Σουζάνα και επιστρέφει στην επιστροφή παιχτών gntmgr	0
@USER Να την ονομάσεις 'συριζόκολλα' αφού είσαι κολλημένος στην τσιπροπαρέα ως χρήσιμος αυτοκόλλητος και να αξιώσεις υπουργικό θώκο όταν το 2219 αναλάβουν και πάλι την εξουσία .	0
Δεν ξέρω όλοι οι άντρες θα έπρεπε να ντρέπονται για όλες τις γυναίκες που είναι μόνες ή όλες οι γυναίκες θα πρεπε να ντρεπόμαστε που τους ευνούχισαμε Κ κάνουμε λάθος επιλογές . Βασικά ντροπή όλων μας που περνάμε τα καλύτερα μας χρόνια χωρίς έρωτα	0
Η γνωστη πλεον τακτικη . Οποτε γραφουν αρθρο για τους ΔΗΘΕΝ προσφυγες βαζουν και φωτο μωρων . Ο λογος ξεκαθαρος . Κτυπουν στο συναισθημα του Ελληνα για να μην αντιδρα στην αντικατασταση του και την Φυλετικη, Εθνικη, Θρησκευτικη και Πολιτισμικη αλλοιωση της ταυτοτητας του	1
Αχ γυρισε ο παλιος καλος μπρατης που τις θιχαινεται ολες βαλτες στη θεση τους mi amor gntmgr	0
Μου έχει ΛΑΤΡΕΜΕΝΟ Τάσο Ξιάρχο το mesanyxta μετά το erwtasmeta απέναντι σε μανουλομάνουλο Γιάννη Κουκουράκη του the2nightshow μετά τις agriesmelisses ; ΓΙΑΤΙ ΜΟΥ ΤΑ ΚΑΝΕΤΕ ΑΥΤΑ;	0
@USER Ανδρέα Πανανδρέου εσύ είσαι; Το 2019 ρε; Έλεος γελάω . Είχα συμπληρώσει στο προηγούμενο σχόλιο ότι δεν είμαι ΝΔ . Αλλά το έσβησα πρώτον για να επιβεβαιωθώ ότι θα έγραφες κάτι τέτοιο και δεύτερον γιατί ΔΕΝ ΣΕ ΝΟΙΑΖΕΙ ΤΙ ΕΙΜΑΙ . Σε νοιάζει τι λέω και τι κάνω .	0
Όλοι σφάζονται, θυσιάζονται κι ο Μίλτος ράβει υπόλευκα μεταξωτά κοστούμια ! kokkinopotami	0
Πόσα πλάνα πια αυτοί οι κωλοι; Δεν ξέρουν ότι η πλειονότητα του κοινού τους είναι γυναίκες και gay άνδρες; GNTMgr	1
Χαρά, μάθε τους να φέρονται, ρε ! gntmgr	0
Ο κ . Ανδρέας Λοβερδος συχνά πυκνά απειλεί τη Δικαιοσύνη . Μόνο που δεν μας λέει εφόσον αισθάνεται Αθώος γιατί δεν αφήνει τη Δικαιοσύνη να κάνει τη δουλειά της . Η μήπως τελικά δεν είναι και τόσο Αθώος ; Που είσαι Ανδρέα Παπανδρέου να καμαρώνεις τα Παιδιά σου !	0
@USER Γραψ'τους στα αρχιδια κοριτσαρα .	1
Έλεος μωρή Ελλη, πατέρας τους είναι . Εσυ τον εξαγόρασες κάποτε και του κατσικώθηκες με το ζόρι ! Σήκωσες και τουπέ, σιχτιρ πια GynaikaXwrisOnoma	0
Ευτυχώς που του Μπράτη δεν του αρέσουν οι γυναίκες θα τον είχε βάλει κ αυτόν στο βρακι της η Κατια gntmgr	0
Σωπα ρε φιλε ! Ειχε γινει η τελεια ληστεια σε τραπεζα στην Ελλαδα το 1992;! Περιεργο που δεν το θυμαμαι . Λα καζα ντεπαπέλ αλα γκρέσια δηλαδης kalytera	0
@USER Ψόφον ούλλοι ως τον έναν αφού νιώθουν τούρκοι γιατί εν φέφκουν να παν στην τουρτσιά τους οι λεχρίτες	1
ΡΕΝΑ ΜΗΝ ΜΙΛΑΣ ΚΑΘΟΛΟΥ . ΕΙΣΑΙ ΗΛΙΘΙΑ . ΚΑΙ ΟΧΙ ΔΕ ΣΕ ΣΥΓΧΩΡΟΥΜΕ GynaikaXwrisOnoma	1
Πάντως το μόνο που αξίζει από όλο το επεισόδιο, είναι το τελος που τις κρίνουν . Όλο το υπόλοιπο δε βλέπεται gntmgr	0
@USER Ξεμένσιωσέ με να μη χρειάζεται να διαβάζω τις χίλιες δυο ηλίθιες δικαιολογίες σου .Ναι η Τουρκία αφήνει τη Frontex -υπάρχει συμφωνία, η Μόρια είναι κολαστήριο,μετανάστες πνίγονταν και επί σύριζα και σαλτα κ γαμήσου επιτέλους που το μόνο που σε νοιάζει είναι οι ψήφοι Σρζ	0
Είναι κ βλάκες που συγκρίνουν το 2015 που οι μετανάστες περνούσαν τράνζιτ από την Μπανανία μέσα σε 1 24ωρο . Από τα νησιά με παπόρια Πειραιά κ απο εκεί με πούλμαν Ειδομένη . ΤΡΑΒΑ ΨΟΦΑ ΡΕ ΒΛΑΚΑ	1
Δεν είναι σνομπ η Ελευθεριτσα μωρέ ... Γλυκούλα ! gntmgr	0
gntmgr καλά δεν θα σας δείξει η Καγιά και την εγχείρηση ανοιχτής καρδιάς .χαλαρωστε λιγο	0
Aντρεα άλλη φορά να μας προειδοποιείς giatinparea	0
Το ωραία καλέ που το είδες gntmgr	0
Ελάτε γκιοσουλες ...Να κι εμείς εδώ σημαιοστολισμενοι περιμένουμε την κοντέσσα Βαλαιρενα από τις δύο ... "Έχει πολλή κίνηση κούκλα μου, στο δρόμο είμαι". Λες κι έρχεται μέσω Λαμίας ξέρω εγώ ... Ευτυχώς που έχω κλείσει κ μασάζ χαλαρωτικό στις επτά . Ελπίζω να έχει φτάσει shoppingstar	0
Τον Καρυστινό ολο με ντιλιβερι τον ειχε η ηλεκτρα . Στον γκομενο μοσχαράκι κοκκινιστό . erwtasmeta	0
Φωνάρα ! Αγάπησα το νέο τραγούδι της @USER ! ️️️ XFactorGR thefinal4Gr TheVoiceGR	0
Πόσο τις χαίρεσαι όμως αυτές τις δύο στη Μύκονο αυθεντική την χαρά και χωρίς ίχνη μαλάκινσης ... gntmgr	0
Η γάτα μου στο gntmgr !	0
@USER μηπως δεν εχετε καταλαβει ακομα οτι με 1000000 προσφυγες και λαθρομεταναστες,με Μοριες,Ειδομενες,OLAF,δεν δικαιουστε να μιλατε για μεταναστευτικο ;	1
ΑΝΎΠΑΝΤΡΗ ΘΑ ΜΕΊΝΩ Η ΠΟΥΤΑΝΑ	1
@USER Alex ενταξει ρε συ είπαμε είσαι ολυμπιονίκης κλπ αλλά μήπως έφαγες πολλές κλωτσιές στο κεφάλι;τι είναι αυτά που γράφεις και παραπληροφορείς;	0
εκλογες2019 Εκλογες_2019 Τσίπρας ΣΥΡΙΖΑ παρτε μια μικρη ιδεα για το πως δουλευει η προπαγανδα των νδ_ξεφτίλες στους καφενεδες στην επαρχια ....... φωτο Α και Β	0
ΜΠΙΘΙΚΩΤΣΗΣ ΜΙΑ ΓΥΝΑΙΚΑ ΦΕΥΓΕΙ Μαραμένα μες στο βάζο τα λουλούδια λυπημένα σ’ ένα κάδρο αγγελούδια . Δίπλα η βρύση με ρυθμό στάζει φριχτό τρίζει η πόρτα κι είν’ το σπίτι ανοιχτό . Μια γυναίκα φεύγει, μια σωστή κυρία τα βήματά της σβήνουν μια θλιβερή ιστορ	0
Πέρασε η Ασημινα που ήταν εκτός κονσεπτ GNTMgr	0
@USER Για να αποκαλύπτει στον λαό τι συζητιέται εκεί μέσα και να πρωτοστατεί στην πάλη εναντίων τους . Μήπως αν είσαι κατά της ΕΕ εξαιρείσαι από αυτά που αποφασίζουν για σένα;	0
